text	label
Mr. McDonald started the evening with his own set , featuring hits from his solo career and his Doobie Brothers years and a selection of R&B cover songs that met with mixed results .	neutral
Adanac Molybdenum of Canada has ordered grinding technology for its molybdenum project in British Columbia , Canada , while Shalkiya Zinc of Kazakhstan has awarded a contract for grinding technology for the Shalkiya zinc-lead project in Kazakhstan .	positive
ADP News - Feb 13 , 2009 - Finnish retailer Kesko Oyj HEL : KESBV said today its total sales , excluding value added tax VAT , stood at EUR 661.3 million USD 853.1 m in January 2009 , down 15.2 % year-on-yea	negative
In the Baltic countries , sales fell by 42.6 % .	negative
Nokia is also negotiating the product portfolio of the new company .	neutral
In Finland , 71 % of paper and paperboard is reclaimed .	neutral
Systeemitiimi 's sales and project resources will also be strengthened , director Paul Skogberg said .	positive
Swedbank Hypotek - Is to issue a benchmark , fixed rate covered deal in Euros , maturing January 2010 .	neutral
This acquisition supports our strategy of being close to our customers all around the world offering both equipment and related services .	positive
SOUTHFIELD , Mich. -- Central Corporate Credit Union will again distribute patronage dividends to members by waiving all service fees incurred during the months of July and November 2008 , to the tune of an estimated $ 1 million .	positive
In a note to clients published , the Dutch broker described the company 's third quarter results as ` soft ' , although it also noted that Elcoteq retained its guidance , dealers said .	neutral
Investments span across various product and investment types , including retail , hospitality , office , and residential , with interests in real-estate portfolios , non-performing loans and corporate restructurings .	neutral
`` We are pleased to welcome Tapeks Noma into Cramo group .	positive
Growth is expected to continue in 2008 .	positive
OP-Pohjola Group 's capital adequacy ratio under the Act on Credit Institutions stood at 12.1 % and Tier 1 ratio at 12.1 % .	neutral
The acquisition is part of Ramirent 's strategy to strengthen its position in selected locations .	positive
Choose from a Giant Countdown with red head or rainbow trout -- or the Giant Shad Rap in perch color .	neutral
Following the issue , the number of shares in the Swedish company will grow by 9 % .	neutral
On January 29 , 2009 The largest Nordic bank Nordea and Finnish retail chain Stockmann launched a regionally unique cooperation project : they are the first to introduce a common MasterCard credit card enabling payments in different states and stores .	neutral
Previously , the plant was expected to be completed by the end of 2008 .	neutral
Supported Nokia phones include : N96 , N95-8GB , N95 , N93-N931 , N92 , N85 , N82 , N81 , N80 , N79 , N78 , N77 , N76 , N75 , N73 , N72 , N71 , E90 , E71 , E70 , E66 , E65 , E62 , E61-E61i , E60 , E51 , E50 , Touch Xpress 5800 , 6220 Classic , 6210 Navigator , 6120 Classic , 6110 Navigator , 5700 , 5500 , 5320XM .	neutral
Raute , headquartered in Nastola , Finland , is a technology company serving the wood products industry worldwide .	neutral
Exel is headquartered in Mantyharju in Finland .	neutral
It is in line with its plans to focus on selected growth segments and streamline corporate structure .	positive
On the basis of competitive bidding OOO Kitai Stroi , the Russian subsidiary of China State Construction Engineering Corporation , a construction company owned by China State , has been selected as the main constructor .	neutral
`` These patronage refunds reward members that use the fee-based services that make a positive contribution to CenCorp 's operating results , '' said Bill Walby , CenCorp CEO .	neutral
The winner does not have to be present to win .	neutral
The last quarter was the best quarter of 2009 in net sales , and the operating margin rose to 12.2 % .	positive
The deal is subject to approval by the Norwegian competition authorities .	neutral
`` Over the years , the color orange has become synonymous with quality .	neutral
Rinkuskiai raised the sales by 18.1 percent , to 1.37 million liters , while the sales of Kauno Alus grew by 14.3 percent , to 960,000 liters .	positive
What we think ?	neutral
Finnish electronics contract maker Incap Oyj said on January 3 , 2008 it sold its manufacturing facilities in Helsinki to local real estate company Sponda Oyj for 5.3 mln euro ( $ 7.8 mln ) .	neutral
The price of raw material aluminium went up at the end of 2005 , but the company considers its outlook for 2006 favourable .	positive
Why put up costly cell phone towers in thinly populated areas when a few balloons would do ?	neutral
The investments and operational changes enable additional optimisation of the working hours and thereby further cost savings of some 7 % -9 % .	positive
Poyry Energy GmbH is Austria 's leading engineering and consulting company in the energy , infrastructure and environment sector , owned by Poyry Plc. and the Austrian Verbund AG .	neutral
Cencorp would focus on the development , manufacture and marketing of standard products for production automation .	neutral
It combines a perfect price performance with sophisticated management facilities , the company said .	positive
This new partnership agreement represents a significant milestone for both parties .	positive
SWOT analysis is just one method of categorization and has its own weaknesses .	neutral
Outotec 's net profit for the second quarter of 2007 jumped to 16.8 mln euro ( $ 23.1 mln ) from 4.6 mln euro ( $ 6.3 mln ) a year ago .	positive
The figure does not include food exports from Finland .	neutral
The tanks will be delivered to a company which is currently building a chemical tank farm in Antwerp , northern Belgium .	neutral
The desk will reach its full planned strength of ten persons in autumn 2007 .	neutral
L&T has also made a commitment to redeem the remaining shares by the end of 2011 .	neutral
Operating profit for continuing operations fell to EUR 48.3 mn from EUR 72.4 mn in the first half of 2007 .	negative
Incap , headquartered in Oulu , Finland , is a electronics contract manufacturer with some 750 employees in Finland , Estonia and India .	neutral
The value of the order is EUR 2.5 mn .	neutral
Production at the plant will be based on Neste Oil 's proprietary technology that can use a flexible input of any vegetable oil or animal fat .	neutral
says Brian Burton , Head of IT Security , Vodafone UK .	neutral
Operating profit decreased to nearly EUR 1.7 mn , however .	negative
Operating profit margin was 8.3 % , compared to 11.8 % a year earlier .	negative
The following information was released by Comptel : Tomorrow the Chairman of the Federal Communications Commission is scheduled to deliver the National Broadband Plan to Congress .	neutral
The fair value of investment properties was EUR 2 251.0 ( 1 281.4 ) million .	neutral
That 's what I go to bed worrying about every night , ' he said .	negative
Around 250 of these reductions will be implemented through pension arrangements .	neutral
The company said that its investments in the new market areas resulted in sales increase in Sweden , Poland , Russia and Lithuania .	positive
Panostaja treats its negotiating partners , such as entrepreneurs selling their life s work and newcomer entrepreneurs seeking a career , fairly , justly and according to the law .	neutral
Finnish silicon wafer technology company Okmetic Oyj OMX Helsinki : OKM1V reported on Thursday 30 October an operating profit of EUR7 .4 m for January-September 2008 , up from EUR6 .1 m in the corresponding period in 2007 .	positive
In December , Amer announced the dismissal of CEO Roger Talermo , who had headed the company since 2006 .	neutral
The company can be split into two parts over the coming months , with Essent owning and operating production and supply , and Enexis owning and operating the grid .	neutral
Loss after financial items totalled EUR 9.7 mn , compared to a profit of EUR 1.3 mn in the corresponding period in 2008 .	negative
A spokesman said : `` The food store center , subject to council and local support , could comprise a supermarket or smaller store and other niche outlets , and this will be firmed up following consultation with the council and local community regarding appropriate uses and occupiers . ''	neutral
The aim is to convert the plants into flexible manufacturers of new and technologically demanding products .	positive
The Polish business employs about 1,000 people , and it had net sales of about EUR 70mn in 2007 .	neutral
You need to be ready when the window opens up , Rosberg said .	neutral
Most of the growth in beer consumption took place in the Far East , Latin America and Africa .	neutral
1 April 2011 - Finnish machinery rental company Ramirent Oyj HEL : RMR1V said today it has acquired the assets of sector player Stavebni Doprava a Mechanizace SDM in the Czech Republic for an undisclosed sum .	neutral
The company confirmed its estimate for lower revenue for the whole 2009 than the year-ago EUR93 .9 m as given in the interim report on 5 August 2009 .	negative
In addition , the company is considering the start of production in Russia .	neutral
Business boomed after Ostrom helped plant a small story about Rapala lures in a Life magazine issue that featured Marilyn Monroe on the cover .	positive
In the financial statement for the first quarter of 2010 , Tikkurila is reported under discontinued operations .	neutral
According to Finnish insurance companies Tapiola , Local Insurance Group ( L+Æhivakuutus ) , and Pohjola the two fierce storms at the end of July and in the beginning of August 2010 that felled trees around Finland have speeded up sales of forest insurance .	positive
The manager is critical of politicians ' failure to differentiate between beleaguered European financial institutions and Skandinavian banks , `` which sailed through the crisis without issues '' .	neutral
New Chairman of the Board of Directors , Mr Chaim Katzman , will give a presentation and answer questions .	neutral
In Finland , Hamina Cargo Terminal , of Finnish Nurminen Logistics , has purchased a warehouse with ground lease rights in the Port of Hamina .	neutral
Net sales decreased to EUR 91.6 mn from EUR 109mn in the corresponding period in 2005 .	negative
Stonesoft is a global provider of proven , next generation solutions that simplify network security management .	neutral
Finnish Larox has signed a contract with the Talvivaara Project for the delivery of filters to the Talvivaara nickel mine in Sotkamo , in Finland .	positive
The company said Offshore segment represented 43 % of the total marine engines orders for the July-September 2010 period , Merchant 33 % , Special vessels 18 % , and Cruise and Ferry , and Ship Design -- 2 % and 3 % , respectively .	neutral
OVA Press has a 60 % stake in the joint venture , while IMSM holds a 40 % stake .	neutral
Viking Line manages well with its current ferries .	positive
The diesel margin has remained high .	positive
Three students from Universiti Sains Malaysia have won a study trip to Helsinki .	neutral
Orders received grew by 55 % year-on-year to EUR732m .	positive
Device volume in the area decreased by 21 % to 2.7 mn units .	negative
The company moved to an operating profit of EUR10 .9 m versus an operating loss of EUR15 .3 m. It also turned to EPS of EUR0 .08 versus loss per share of EUR0 .04 .	positive
The company said it observed a current stabilisation in prices and there is potential for higher prices for deliveries in the first quarter of 2011 .	positive
Scanfil holdings include 100 % of contract electronics manufacturer Scanfil EMS Group .	neutral
Lithuanian beer makers sold 256.88 million liters of beer in 2005 , a rise of 4.5 per cent from the year-earlier figure of 245.92 million liters .	positive
The contract covers new energy-efficient AC drives that have been designed in cooperation between the companies .	neutral
Finnish food industry companies are interested in the opportunities provided by Ukraine .	neutral
Outotec 's scope of delivery covers the engineering , supply of special equipment and services for a calcination plant with two circulating fluid bed calciners .	neutral
The interim report for the first quarter is published on May 8 , 2009 .	neutral
Kesko Agro Eesti , the retailer and wholesaler of grain , agricultural and warehousing machinery and accessories , had net sales of 81 million euros in 2007 , an increase by one-tenth over the preceding year .	positive
Operating profit was EUR 0.6 mn , up from a loss of EUR 19mn a year earlier .	positive
The floor area of the Yliopistonrinne project will be 7,900 sq m and the building 's gross area will total 12,800 sq m. A total 25.1 % of the facilities have been let .	neutral
About Nokia Nokia is a pioneer in mobile telecommunications and the world 's leading maker of mobile devices .	positive
According to L+Ænnen Tehtaat 's CEO Matti Karppinen , the company aims to deliver fish products to its customers a day earlier than it currently does .	neutral
Helsingin Uutiset , Vantaan Sanomat and Lansivayla reach some 385,000 readers , or more than 40 % of the consumers in the greater Helsinki region .	positive
Published by Globes online , Israel business news - www.globes-online.com - on November 16 , 2009 -_ Copyright of Globes Publisher Itonut 1983 Ltd. 2009	neutral
GSK announced in November 2008 that it would close its operations in Dartford .	negative
Operating profit margin increased from 11.2 % to 11.7 % .	positive
Finnish sports equipment maker Amer Sports Oyj ( HEL : AMEAS ) said today that its net loss narrowed to EUR 16.9 million ( USD 22.3 m ) in the second quarter of 2010 from EUR 23.2 million in the corresponding period a year earlier .	positive
With the new production plant the company would increase its capacity to meet the expected increase in demand and would improve the use of raw materials and therefore increase the production profitability .	positive
`` Residentialconstruction in particular has picked up in several markets .	positive
FINANCING OF ASPOCOMP 'S GROWTH Aspocomp is aggressively pursuing its growth strategy by increasingly focusing on technologically more demanding HDI printed circuit boards PCBs .	positive
Wartsila won the contract in October 2007 and the plant will be installed at Manturovo in the Kostroma region of Russia , about 600 km northeast of Moscow , Russia .	positive
The company has some 410 employees and an annual turnover of EUR65 .4 m. Vaahto Group is listed on the Nordic Exchange in Helsinki .	neutral
Nonwovens and specialty papers , made by Ahlstrom , are used in a large variety of everyday products , e.g. in filters , wipes , flooring , labels , and tapes .	neutral
The business area has operations in Finland , Sweden , Denmark , Estonia , Latvia and Lithuania .	neutral
Operating profit rose from EUR 1.94 mn to EUR 2.45 mn .	positive
After the signing , the total amount of Aspo 's revolving credit facility agreements is EUR 50 million , which replaces the formerly valid agreements of EUR 80 million .	neutral
Depending on the market situation , such projects are sold after 1 to 3 years after completion .	neutral
Risto Raty , Tekla 's executive vice president , said that Tekla Structures and ArchiCAD will cover the entire design and documentation workflow throughout a construction project .	neutral
Airbus will attempt to evacuate up to 873 people within 90 seconds .	neutral
Aldata Solution Oyj Thomas Hoyer CFO More information : Aldata Solution Oyj , Thomas Hoyer , CFO , tel. +358 45 670 0491 Aldata in brief Aldata Solution is one of the global leaders in supply chain software for retail , wholesale and logistics companies .	neutral
This corrensponds to 4.628 percent of Okmetic 's share capital and voting rights .	neutral
Some of the most recent technology deliveries include refinery technology to Anrak Aluminium , an iron ore pelletizing plant to Tata Steel and iron ore sintering plants to Bhushan Steel .	neutral
The aim is to develop open-source application solutions .	neutral
Insurer Axa ( PAR : CS ) slid by 5.35 % to EUR 14.15 , after Citigroup and ING slashed their targets on the stock .	negative
The share capital of Alma Media Corporation (business ID 1944757-4)is EUR 45,031,513.80 and it is divided into 75,052,523 shares .	neutral
ZAO YIT Moskovia builds housing in Moscow and its surrounding cities .	neutral
The measures result from weak demand in the shipbuilding industry .	negative
Pertti Ervi is independent from the Company and its major shareholders .	neutral
Water Treatment Products In Australia Today , Global Research & Data Services is going to publish a market analysis about the market for chemical water treatment products in Australia .	neutral
The contract is worth some EUR 1 million .	neutral
Steve Jackson , eBusiness Analyst at Satama and former CEO of Aboavista said : `` Google broke the mold when they gave away Google Analytics for free .	neutral
A meeting for the media and analysts will be held on the same day at 10:30 a.m. at Stonesoft Headquarters in Helsinki , Italahdenkatu 22 A. The Interim report will be presented by Stonesoft 's CEO Ilkka Hiidenheimo .	neutral
Aspocomp has a large factory in China and a factory building project in India that was halted due to financing problems .	negative
Ahlstrom Corporation Seppo Parvi , CFO Distribution : Main media www.ahlstrom.com Ahlstrom in brief Ahlstrom is a global leader in the development , manufacture and marketing of high performance nonwovens and specialty papers .	neutral
SysOpen Digia Plc , Press release , 7 February 2006 IBM Finland has rewarded its most distinguished partner companies for 2005 .	positive
A total of 38,244 new Citycon shares with a nominal value of EUR 1.35 per share were subscribed on 19 April exercising the A-B-C options based on the company 's stock option plan 1999 .	neutral
We offer challenging and interesting employment for over 20,000 people in 20 countries throughout Europe .	neutral
He is a member of the Board of numerous com-panies and a shareholder of the Boardman Ltd board specialist net-work .	neutral
According shipping company Viking Line , the EU decision will have a significant financial impact .	neutral
A realignment of interests in the sector is clearly under way .	positive
Net sales are expected to remain on the same level as in 2007 .	neutral
Also Chile is an important market area for forest machine companies .	neutral
Raute reported a loss per share of EUR0 .86 for the first half of 2009 , against EPS of EUR0 .74 in the corresponding period of 2008 .	negative
Metso expects its net sales to increase by about 10 % in 2008 , at comparable exchange rates .	positive
Sponda Plc Stock Exchange Release 5 December 2006 at 15.45 EUR 1.5 BILLION SYNDICATED CREDIT FACILITY FOR SPONDA Sponda has signed an agreement for a one-year syndicated credit facility for a total of EUR 1.5 billion .	positive
Tekla will organize an information meeting for analysts and media at WTC Helsinki Marski meeting room , Aleksanterinkatu 17 , the same day at 12:30 - 1:30 p.m. Light lunch will be served .	neutral
The maximum obligated total trades per day is ISK 400,000,000 market value .	neutral
Following the divestment , Fiskars 's Outdoor unit will comprise the brands Gerber , Silva and Buster , and will focus on multi-tools , knives , compasses , mobile lighting , pedometers , and aluminium boats .	neutral
Sanoma Magazines ' net sales are estimated to grow in 2006 .	positive
Of these shares 14,747,084 are held by the Company and the number of outstanding shares and voting rights attached to the shares amounts thus to 161,256,847 .	neutral
Founded in 2000 , BioView automates laboratory tests , especially diagnostic tests for cancer .	neutral
The air traffic of Finland has been in stoppage since then .	negative
The employer , together with health personnel , supports quitting and pays part of the cost of nicotine treatments .	neutral
According to M-real 's CEO , Mikko Helander , this transaction will enable the company to proceed swiftly with its restructuring program .	positive
POYRY PLCCompany Announcement 10 December 2010 at 4.10 p.m. Pursuant to Poyry PLC 's stock option program 2004 , 63 792 new shares of the company have been subscribed since 27 October 2010 with stock options 2004B .	neutral
Less than ten people will face pension agreements .	neutral
The report profiles 158 companies including many key and niche players including major Nonwovens manufacturers such as Ahlstrom Corporation , Asahi Kasei Corporation , Buckeye Technologies , Inc. , EI .	neutral
Most of the permanent layoffs will be in the plywood and sawn timber sectors of the Finnish company 's operations at several domestic mills , where earlier this year it temporarily laid off some 1,200 workers to save costs .	negative
Also the city 's insurance company , If P & C Insurance , has said it will not pay compensation .	negative
Validating our fgVoIP client through Symbian Signed represents a significant step forward in accomplishing this goal .	positive
The outsourced Scan and Capture solutions transfer paper invoices into electronic format , and Basware Business Transactions Service allows the customer to receive and send invoices in an electronic format .	neutral
Revenue grew 1 percent to euro742 .2 million US$ 964 million from euro735 million .	positive
The name of the buyer was not disclosed .	neutral
In January-September 2007 , operating profit totaled EUR 20.5 mn .	neutral
Olli-Pekka Kallasvuo was elected as vice chairman of the Board .	neutral
The revenues of the business reached NOK 12 million for 2008 .	neutral
Shares of Nokia Corp. rose Thursday after the cell phone maker said its third-quarter earnings almost doubled and its share of the global handset market increased .	positive
`` The number of collection errors fell considerably , and operations speeded up .	positive
The transaction is in line with Aspo 's strategy to expand in the Baltic Sea region and in the eastern markets .	positive
Activities range from the development of natural resources to the retailed marketing of finished products .	neutral
Last July , the group said it intended to relocate warehouse and office space in Loudeac and Saint Marcel to Morvillars , in the east of France , where it already operates a hook manufacturing and distribution unit .	neutral
The subdivision made sales revenues last year of EUR 480.7 million EUR 414.9 million in 2008 , and operating profits of EUR 44.5 million EUR 7.4 million .	positive
Incap Contract Manufacturing Services Pvt Ltd , a subsidiary of Incap Corporation of Finland , is acquiring the manufacturing unit of the TVS Electronic Ltd at Tumkur , near Bangalore , for Rs40 crore .	neutral
Trading code : ELI1V Number of shares : 99,483 Price-share : Gratuitous After the transfer , Elisa holds a total of 10,435,023 own shares .	neutral
Electricity consumption grows with higher frequencies .	neutral
ADP News - Feb 25 , 2009 - Finnish printed circuit board PCB maker Aspocomp Group Oyj HEL : ACG1V said today it swung to a net profit of EUR 300,000 USD 385,000 for 2008 versus a net loss of EUR 65.3 million	positive
`` Leipurin is a growing and rapidly internationalizing Group .	positive
Profit for the period was EUR 15.6 mn compared to EUR 14.1 mn in 2007 .	positive
Merrill Lynch analyst Campbell Morgan upgraded his recommendation on PaperlinX from `` neutral '' to `` buy '' in May .	positive
It started with software that was capable of retrieving the data typed into the computer keyboard ( `` keyloggers '' ) , and then more complex mechanisms arrived on the scene , such as phishing and pharming .	neutral
More than 14,000 customers were left powerless .	negative
SDM offers general rental equipment , aluminium scaffolding , power generator and hoists to customers in the construction sector .	neutral
After the sale , Savcor Group Ltd will comprise Savcor ART , a corporate function and an investment in Cencorp Corporation .	neutral
The phones are targeted at first time users in growth markets .	neutral
The Russian gas giant invested another 46 million litas in the company in late 2004 and now owns 99.5 percent of its stock capital , which amounts to 86.936 million litas .	neutral
Singapore in May 2011 1 July 2010 - Finnish air carrier Finnair Oyj ( HEL : FIA1S ) said today it will open a daily route to Singapore on 30 May 2011 as part of its growth strategy in Asia .	positive
Finnish Konecranes is again trying to acquire Italian Fantuzzi , a manufacturer of gantry cranes and reach stackers .	neutral
More than a third of the original participants dropped out due to nausea and other side effects .	negative
Result before taxes decreased to nearly EUR 14.5 mn , compared to nearly EUR 20mn in the previous accounting period .	negative
Finland-based international machinery rental company Ramirent Plc ( OMX Helsinki : RMR1V ) said on Friday ( 9 May ) that its president and CEO , Kari Kallio , has informed the board of his intention to retire in year 2009 .	neutral
The program 's target is structural cost reductions of about EUR 30mn in 2009 .	positive
It is a disappointment to see the plan folded .	negative
`` We are happy to be working with Rapala to encourage boaters and anglers to introduce newcomers to the sport , '' said RBFF President & CEO Frank Peterson .	positive
The handset maker did not disclose any financial details .	neutral
Sanoma Magazines Finland 's net sales grew to EUR 140.1 mn from EUR 131.8 mn .	positive
I thank Jarmo Ukonaho warmly for his contribution and wish him all the best in the future challenges . ''	neutral
