text	label
Exel Composites ' long-term growth prospects remain favourable , however .	positive
The Samsung Mobile Applications Store was launched in January 2009 by Samsung Mobile Innovator , a program which enables mobile software developers to create applications for use across Samsung mobile devices .	neutral
Altogether CapMan employs approximately 150 people in Helsinki , Stockholm , Copenhagen , Oslo , Moscow and Luxembourg .	neutral
The segments through which the company operates are Frozen Food business , Seafoods , Vegetable Oil business , Grain Trading and Other business operations .	neutral
UK 's Sarantel to outsource part of its processes to Elcoteq plant in Estonia LONDON , Oct 13 , BNS - The British miniature antennas maker Sarantel has signed an agreement to outsource its assembly test and supply chain processes to the plant of Elcoteq in the Estonian capital Tallinn .	neutral
Dolce & Gabbana has asked the European Union to declare Marimekko Corporation 's `` Unikko '' floral pattern trademark invalid , in a continuing dispute between the two companies .	negative
Pharmaceutical market in Belgium Global Research & Data Services published recently a market analysis about the pharmaceutical markets in Belgium .	neutral
Finnish newspaper publisher Sanoma , of media group SanomaWSOY , is merging its free sheets Uutislehti 100 and Metro as of mid-September 2008 to form a new free sheet to be named Metro .	neutral
Sponda is a property investment company , specialising in commercial properties in the largest cities in Finland and Russia .	neutral
They will cover all Forest Industry 's units and employees in Finland and concern temporary and permanent lay-offs .	negative
Lemcon has also signed a pre-contract for the purchase of the park 's entire 130-hectare site .	positive
Kesko has about 2,000 stores engaged in chain operations in the Nordic and Baltic countries , Russia , and Belarus .	neutral
Tekla will implement the renewal in software versions which will be introduced in spring 2011 .	positive
The new name of the Sanoma Division will be Sanoma News .	neutral
By combining its existing solutions into a single platform , Comptel said that it has reduced the cost of deployment .	positive
( ADP News ) - Jan 22 , 2009 - Finnish mobile phones maker Nokia Oyj ( OMX : NOK1V ) said today its operating profit decreased to EUR 5 billion ( USD 6.5 bn ) for 2008 from EUR 8 billion for 2007 .	negative
HK Ruokatalo now accounts for about 50 % of poultry sales in Finland , and profitability is at a good level .	positive
Sales came in at 241 mln eur , compared with 211.4 mln , and also beating consensus forecasts of 235 mln eur .	positive
According to Gran , the company has no plans to move all production to Russia , although that is where the company is growing .	neutral
ITG 's share in the deal is estimated at some 500,000 euro $ 627,000 .	neutral
These new units will be built at Cargotec 's state of the art manufacturing facility in San Antonio , Texas , USA , which started operations in 2009 .	neutral
Operating profit totalled EUR 9.0 mn , down from EUR 9.7 mn in the first half of 2008 .	negative
The product advisory does not apply to any other Nokia-branded battery , the company said .	neutral
Temporary layoffs in these units have already started .	neutral
The German subsidiary will produce software development services for Ixonos Telecommunications Business Unit 's client projects .	neutral
In addition the production personnel of the Sport Division have been given a temporary lay-off warning .	negative
Operating profit rose to EUR 26.7 mn from EUR 14.9 mn in the corresponding period in 2006 .	positive
A. Le Coq had a market share of 41.3 percent and rival beverage group Saku 32.1 percent .	neutral
The company 's previous estimate was for a lower revenue than the year-ago EUR 93.9 million .	negative
The device can also be used for theft protection and positioning of vehicles , boats and other assets .	neutral
No financial details were provided .	neutral
The business is organised , as of February 1 , 2011 , in a way that production of design services is combined into one entity , Etteplan Operations .	neutral
The second company acquired is Sweden 's Reftele Maskinservice AB , whose business is mainly field services and spare parts manufacturing , with 10 employees and 1.2 mln eur sales a year .	neutral
All reproduction for further distribution is prohibited .	neutral
The company expects its net sales in 2008 to increase 5-10 % from 2007 .	positive
`` We are pleased to deliver the Basware Invoice Automation solution to a major retail company in the US .	positive
The largest construction company in Finland , YIT Corporation , is to acquire 70 % of the shares in the Slovak construction company Reding Bratislava .	neutral
Country : , Switzerland Sector : Pharmaceuticals Target : Synosia Therapeutics Holding AG Buyer : Biotie Therapies Corp Deal size in USD : 129.4 m Type : Corporate acquisition Financing : All-stock Status : Closed	neutral
He is a Chartered Accountant in British Columbia and Alberta as well as a Certified Public Accountant in Washington State .	neutral
Finnish Stockmann Group 's mail order unit Hobby Hall has launched a trial marketing campaign in Russia .	neutral
Finnlines said that the deal is part of its strategy to focus on its core businesses .	neutral
According to the company , the lay-offs will be temporary .	neutral
Profit for the period was EUR 5.9 mn , up from EUR 1.3 mn .	positive
Operating profits in the half were  0.8 m , down from  0.9 m as Glisten invested in the brand and the management team .	negative
Short-term licenses for the games cost as little as $ 3 while purchasing a game outright can cost as much as $ 10 or $ 15 .	neutral
The proposal that the Board of Directors will make at the Annual General Meeting is attached as a whole to this release .	neutral
Sales in Latin America increased by 42 % to EUR 432mn , and a total of 8.7 mn mobile devices were sold in the area , representing an increase of 32 % from the corresponding period in 2009 .	positive
Finnish software developer Basware Oyj said on November 30 , 2006 its U.S. subsidiary Basware , Inc. won an order to provide software for contract lifecycle management to an unnamed U.S. medical technology company .	positive
The company 's board of directors would propose a dividend of EUR0 .15 per share for 2005 .	neutral
Under the contract Cramo Sverige and its subcontractor Brinkab AB will provide all scaffolding installations at LKAB 's new pellets plant in Kiruna in northern Sweden .	positive
So far as is known , he did not sell shares that he owns personally .	neutral
Full-year net sales are expected to increase by approximately 10 % , the company said .	positive
The Financial Statements and Interim Reports will be released around at 9.00 a.m. ( Finnish time ) on the given dates .	neutral
Ixonos will finance the acquisition through a 3.8 mln euro $ 5.2 mln loan .	neutral
Fancy Dans on the move FAB Glasgow gift and interiors store Fancy Dans is moving !	neutral
1 Block lamp Harri Koskinen 's light was introduced in 1996 and has been a bestseller ever since .	positive
When open next year , it will be the largest facility in the world to produce diesel fuel from renewable feedstock such as palm oil and animal fat .	positive
`` Beyond the improved voice capabilities , customers now have a streamlined way to comply with recalls and other traceability requirements , providing them with a competitive advantage .	positive
And earlier this month , the company signed a deal with India-based information technology services giant Wipro Technologies to transfer and sell its radio access related R&D activities in Berlin .	positive
According to him , construction work will start in spring 2007 , and the facility is to be commissioned in spring 2008 .	neutral
The Liquid Handling segment offers laboratory equipment and accessories , including mechanical and electronic pipettes , and disposable tips used in the research institutions , universities , and hospitals , as well as in the pharmaceutical , food , and other industries under the Biohit brand .	neutral
The company plans to close two of the three lines at the plant , where some 450 jobs are under threat .	negative
Alma Media expects its net sales to increase as forecast previously .	positive
However , the suspect stole his burgundy Nissan Altima .	negative
The launch of the plant in June went well , and it has been producing the advanced fuel for a couple of weeks .	positive
Risto Jalo , chief executive of Dormus Print and also owner of the remainder of the company , will keep his position after the acquisition .	neutral
It now owns 80,565 shares in Amer Sports Corporation , equaling 0.11 % of the company 's share capital and voting rights .	neutral
In 2005 the bank posted a net profit of Lt 8.2 mn .	neutral
The repurchases shall decrease the distributable capital and reserves .	negative
The Federal Secretary for Transport and Communication of Mexico has awarded Poyry and its Mexican partner Sintra a consulting contract in connection with the Buenavista-Cuautitlan suburban railway .	positive
Finnish food industry companies HK Ruokatalo and Atria will form a joint venture company called L+Ænsi-Kalkkuna to produce turkey meat .	positive
HELSINKI ( Thomson Financial ) - Kone said it has won four orders in Saudi Arabia , United Arab Emirates and Qatar worth 40 mln eur .	positive
The fair value change of investment properties was EUR 15.8 mn , compared to EUR 22.9 mn in the third quarter of 2009 .	negative
As much biomass will be used as can be sourced locally , with the rest of the plant 's fuel needs met by peat .	neutral
The impact of this acquisition to Teleste 's net sales for 2010 is estimated to be approximately EUR 2 million .	neutral
Net profit in the three months through March 31 fell to (  x20ac ) 103 million ( US$ 165 million ) from (  x20ac ) 131 million a year earlier , the Finnish company said .	negative
Cargotec Germany GmbH has been awarded a contract by Stadtverwaltung Mainz for chassis bodies under Open procedure .	positive
Alma Media Corporation Press Release 15 March 2010 TYRVAAN SANOMAT AND PAIKALLISSANOMAT BEING BOUGHT BY SUOMEN PAIKALLISSANOMAT Two local papers , Tyrvaan Sanomat and Paikallissanomat , appearing in Sastamala and its neighbouring municipalities , are to be bought by Suomen Paikallissanomat Oy .	neutral
The report will be emailed within 2 business days of an order .	neutral
The office space will rise above the remodeled Cannon Street underground station .	neutral
Intellisync Wireless Email from Nokia is a full-featured wireless e-mail solution that connects users to their e-mail , calendar , contacts , notes and task lists while away from the office , according to the company .	neutral
SCOPI Chief Business Excellence Officer , Eng .	neutral
In 2007 , Contempus generated revenue of NOK 69.3 ( approx .	neutral
In the Czech Republic , the smaller profiling unit at Ostrava will be closed and the machinery will be gradually relocated to Ruukki 's bigger plants in Hungary , Poland and Romania by the end of the first quarter of 2009 .	neutral
When completed , the 120-meter Watchtower will be the highest building in Ireland .	neutral
Cathay Forest 's strategy is to develop sustainable , regenerative forest assets .	neutral
The Marubeni Group focuses on creating `` value chain '' from upstream to downstream , encompassing a wide variety of business fields , including oil & gas , metals , mineral resources , foods , pulp & paper and chemicals , among others .	neutral
Press release 9 October 2009 Ruukki has signed a contract to deliver and install the steel structures for a bridge over the Kyronsalmi strait in Savonlinna , Finland .	positive
Ahlstrom , headquartered in Helsinki , Finland , is a global company involved in the development , manufacture and marketing of high performance fibre-based materials .	neutral
Another noticeable thing is that the search for Tata and Airtel brands was mostly related to ` broadband connections ' .	neutral
The Elcoteq group recently announced that the last three months of the previous year brought to it a major loss of more than half a billion kroons ( EUR 32 mln ) for the fifth quarter running .	negative
Russian export duties will activate harvesting in Finland , and sales in Russia will increase also .	positive
Finnish metal products company Componenta Oyj ( HEL : CTH1V ) said today its net loss narrowed to EUR 500,000 ( USD 680,000 ) in the last quarter of 2010 from EUR 5.3 million for the same period a year earlier .	positive
Changes in the market situation and tougher price competition have substantially reduced demand for bread packaging manufactured at the Kauhava plant , according to the company .	negative
The order includes a steel frame , load-bearing roof structures and partition wall elements , and Rautaruukki said it expects to complete installation as early as May next year .	neutral
The aforementioned shareholders have informed that they will propose to the Annual General Meeting that the number of members of the Board of Directors shall be five and that besides the present members of the Board of Directors also Mr Lassi Noponen shall be elected to the Board of Directors .	neutral
`` This contract demonstrates our ability to apply our minerals and metals technologies in adjacent industries , such as oil shale processing .	positive
Seven-month sales of Ragutis , which is controlled by the Finnish brewery Olvi , declined by 11.2 percent , to 15.41 million liters , and the company held 9.89 percent of the market .	negative
The Baltimore Police and Fire Pension , which has about $ 1.5 billion , lost about $ 3.5 million in Madoff Ponzi scheme .	negative
Finnish messaging solutions developer Tecnomen Corporation ( OMX Helsinki : TEM1V ) said on Thursday ( 11 December ) that it has received an expansion order for its Convergent Charging solution in Latin America .	positive
The order includes a new Crecent former , headbox , and reel .	neutral
A filter is used to pre-process packets to determine if they need to be further processed by the processor of the network device .	neutral
Saunalahti is a part of the Elisa group .	neutral
Poyry has a good track record of major transportation projects in Latin America .	positive
The indexes include the top companies that are committed to sustainable development .	neutral
The Department Store Division 's sales fell by 8.6 % to EUR 140.2 mn .	negative
Operating profit rose to EUR 13.5 mn from EUR 9.7 mn in the corresponding period in 2006 .	positive
The Whitehall Street Real Estate Funds invest in real estate and real estate related assets , principally through the acquisition of real estate companies , real property and mortgage loans .	neutral
Raute said it has won an order worth around 15 mln eur to supply several plywood production lines to mills operated by Russian wood products company Sveza Group .	positive
The company said that the fall in turnover had been planned .	negative
The proposal by the Board of Directors on the issuance of option rights will otherwise correspond to the proposal by the Board of Directors in the Notice to the General Meeting .	neutral
`` Consumers have very well received our packed fresh meat .	positive
The Group 's revenue amounts to over EUR 80 million , about half of which is accounted for by exports .	neutral
Pre-tax profit totaled EUR 397.4 mn , up from EUR 164.7 mn .	positive
2009 3 February 2010 - Finland-based steel maker Rautaruukki Oyj ( HEL : RTRKS ) , or Ruukki , said today it slipped to a larger-than-expected pretax loss of EUR46m in the fourth quarter of 2009 from a year-earlier profit of EUR45m .	negative
The price of the 10,000 kroon par value bonds was 9663,51 kroons in the primary issue .	neutral
s NASDAQ OMX : GEO1V , GyPSii business unit , developers of the award-winning GyPSii mobile social networking application , today announced its availability as a free download via the Samsung Mobile Applications Store .	neutral
BasWare Invoice Processing , BasWare Contract Matching , BasWare Order Matching and BasWare KPI Reporting Tool are part of the BasWare 's Enterprise Purchase to Pay solution suite .	neutral
According to CapMan Plc 's Corporate Governance , the majority of the committees ' members shall be independent of the Company .	neutral
Earnings per share ( EPS ) in 2005 decreased to EUR1 .87 from EUR1 .89 in 2003 .	negative
The major part of the deliveries include different AC and CXE amplifier solutions and products by Belgian DINH Telecom , a broadband solutions company acquired by Teleste in the spring of 2007 .	neutral
As a consequence the Works Council had withdrawn its petition to suspend the reorganisation .	neutral
Marathon estimates the value of its remaining stake in Protalix at $ 27 million .	neutral
The company 's set of services include digital printing , printing preparation , offset-printing , after-treatment services and send out services .	neutral
Basware Business Transactions Service enables the customer to receive and send invoices in an electronic format .	neutral
The Commission is to be applauded for applying a fact-based and data-driven approach and for providing clarity for future petitions .	positive
OUTOTEC OYJ PRESS RELEASE DECEMBER 4 , 2009 10.30 AM Outotec establishes a new subsidiary in Kolkata Outotec has established a subsidiary in India in order to better serve its Indian customers and to increase its business in the growing Indian market .	positive
Mformation and Nokia noted they have established interoperability agreements that cover commercially proven , standards-based management of mobile devices , as well as mobile device security and mobile application management .	positive
The sale price was not disclosed .	neutral
Europe however remains an important and strong market for us .	neutral
The potential acquirer is Cencorp Corporation which is a related entity to SAV owing to each of SAV and Cencorp being a subsidiary of the Finnish Savcor Group Oy .	neutral
The annual net sales of the unit is some EUR 5 million and it currently employs some 55 people .	neutral
Operating profit was EUR 139.7 mn , up 23 % from EUR 113.8 mn .	positive
HELSINKI ( AFX ) - Metso said it will upgrade one of UPM-Kymmene 's four paper machines at the latter 's mill in Jaemsaenkoski with a new coating color supply system , machine and process controls and quality measurements .	positive
Nokia will certainly disagree with Qualcomm 's views on the patent situation .	negative
Goodwill and other intangible assets account for some 2.0 mln euro ( $ 2.6 mln ) of the purchase price , 20 pct of which payable in Aspo shares .	neutral
`` I 'm happy with the outcome , '' Sneed said after the hearing .	positive
He announced a `` solutions unit '' to speed co-operation in August , and shifted Simonson from finance chief to low-end phones in October .	neutral
The tower it chose to add , due to go into operation in the summer , will increase total capacity to 80 broadsheet or 160 tabloid pages , with the ability to run 32 - and 48-page products side by side .	positive
Nordea Bank AB publ holds 6.000 Alma Media shares , representing 0.008 % of share capital and voting rights .	neutral
Compared with the FTSE 100 index , which rose 28.3 points or 0.5 % on the day , this was a relative price change of 2.3 % .	positive
Prothious Engineering ( www.prothious.com ) employs more than 1,000 and has a large portfolio of projects and an annual detailing capacity of more than 100,000 tonnes .	neutral
Stora Enso Oyj said its second-quarter result would fall by half compared with the same period in 2007 .	negative
In the third quarter of 2010 , net sales increased by 5.2 % to EUR 205.5 mn , and operating profit by 34.9 % to EUR 23.5 mn .	positive
The personnel reduction will be carried out in Anjalankoski , Hollola , Jyvaskyla , Jarvenpaa , Karhula , Turku and Valkeakoski units .	negative
Also , CBA is to issue a benchmark , 10 year fixed rate deal in Euros .	neutral
Uponor maintains its full-year guidance for 2010 .	neutral
The bond , with a maturity of five years , is part of the bank 's domestic bond program .	neutral
Technopolis said before the protocol was signed that the techno-park would be built at a site covering more than six hectares in the Neudorf special economic zone and that it planned to invest 200 million euros in the project until 2009 inclusive .	neutral
Olvi has posted a strong set of figures for the first six months of this year .	positive
`` The summer collection 2008 will be joyfully fresh like a vitamin injection , '' said H&M 's head of design Margareta van den Bosch .	neutral
ALEXANDRIA , Va. , May 23 -- Matti Harkonen and Pentti Sipponen , both of Espoo , Finland , Osmo Suovaniemi of Helsinki , Finland , and Tapani Tiusanen of Vantaa , Finland , have developed a paper web press device .	neutral
Comptel Corporation will publish its financial statements for 2008 on 12 February 2009 .	neutral
The liquidity providing was interrupted on May 11 , 2007 when Aspocomp Group Oyj 's shares traded below 0.50 cent ( Aspocomp 's stock exchange release 11.5.2007 ) .	negative
You will hear the latest insights and updates on Citycon 's strategy as well as the latest news from all the business units .	neutral
However , the bottom-line result improved thanks to positive financial items .	positive
The agreement will provide The Switch with double the converter capacity , whilst opening up further manufacturing locations in China .	positive
Savon koulutuskuntayhtyma , Finland based company has awarded contract for specialist agricultural or forestry machinery .	positive
Talvivaara also maintains its assumption of turning cash flow positive before the year end .	positive
By acquiring RCP , we can combine our strong knowhow with the expertise of a solid local company .	positive
However , its market share shrank to 47.59 per cent from 48 per cent a year earlier .	negative
Speaking to just-drinks today , a spokesperson for Olvi said : `` We have performed very well in all four countries we operate in - namely , Finland , Estonia , Latvia and Lithuania . ''	positive
With this acquisition Panostaja Oyj further expands its business area specialising in digital printing .	positive
The Estonian beverages maker A. Le Coq today brought to the market a new premium class beer , A. Le Coq Special , investing 6 million kroons EUR 383,000 into its development and planning to sell three million liters of the beer during the next year .	neutral
ALEXANDRIA , Va. , March 15 -- Jaakko Vilo of Turku , Finland , has developed a panel press .	neutral
U.S. District Judge Douglas P. Woodlock yesterday extended a Jan. 17 temporary restraining order until March 7 .	neutral
EB announced in its stock exchange release on November 18th 2008 that J.T. Bergqvist has resigned from the chairmanship and membership of the Board of EB .	negative
The company may at any time have in its possession one tenth of all its shares at the maximum .	neutral
The per-share subscription price of the shares subscribed with the option rights was EUR 1.35 .	neutral
MD Henning Bahr of Stockmann Gruppen praises the trend , since the chains become stronger and their decision-making processes more clear .	positive
The metal has gained 41 percent this year as demand from China , the world 's largest user , increased .	positive
Following the increase , Huhtamaki Oyj 's registered share capital is EUR 358,706,290.00 and the number of shares outstanding is 105,501,850 .	neutral
's Outokumpu Technology business will begin trading on the Nordic Exchange in Helsinki starting Oct. 10 , becoming the sixth company to list on that exchange this year , the company said Friday .	neutral
Cost cutting measures , which have produced around EUR70m of savings over the past nine months , have dampened the airline 's loss , Finnair said .	positive
Last year 's net sales rose to EUR 68.3 million from EUR 62.2 million .	positive
Finnish drug distributor and wholesaler Oriola-KD Oyj said on October 11 , 2006 it named Anne Kariniemi vice president of its Logistics and Sourcing department as of January 15 , 2007 .	neutral
It is also in the process of taking a seat on CapMan 's board - a course which has the support of CapMan management .	neutral
Increase in the number of shares is based on the option rights which were granted to the management of the company under the stock option plan 2006 .	neutral
Kesko www.kesko.fi is a Finnish retail specialist whose stores offer quality to the daily lives of consumers through valued products and services at competitive prices .	neutral
The emerging markets that Raisio has chosen to enter so far are marked by relatively low per capita food consumption .	neutral
4 February 2011 - Finnish broadband data communication systems provider Teleste Oyj HEL : TLT1V said Wednesday its net profit rocketed to EUR4 .8 m in 2010 from EUR416 ,000 in 2009 and it lifted its dividend proposal .	positive
Finnish Ahlstrom Corporation has ordered key production equipment for a new glass nonwovens production line at its Russian Tver Mill from Finnish Vaahto Pulp & Paper Machinery ( that is part of Vaahto Group ) .	positive
In Finland , Martela offers a comprehensive service that can cover the entire process of change from initial inventory and design to removal and maintenance .	neutral
INTERNET BUSINESS NEWS - -_ 1995-2006 M2 COMMUNICATIONS LTD As part of a drive to protect users of its Internet banking service , Barclays Bank has announced that it is to recommend F-Secure Internet Security to its customers .	neutral
A total of 185 Wonderware Certified SIs are available to integrate and support Wonderware products such as InTouch - HMI software , IndustrialSQL Server historian , Wonderware Information Server , DT Analyst software or QI Analyst SPC software .	neutral
